text,intent
recall the caching strategy we decided on,knowledge_qa
what was the agreed naming convention for APIs,knowledge_qa
remember the security concerns we identified,knowledge_qa
what was our decision about the testing framework,knowledge_qa
recall the migration plan for the legacy system,knowledge_qa
what did we conclude about the microservices boundaries,knowledge_qa
do you remember how we solved the race condition,knowledge_qa
what was the rationale for using event sourcing,knowledge_qa
recall the SLA requirements for the service,knowledge_qa
what were the constraints we identified for scaling,knowledge_qa
remember the trade-offs we discussed for the cache layer,knowledge_qa
what was the consensus on code review guidelines,knowledge_qa
recall the monitoring setup we planned,knowledge_qa
what did we decide about the retry policy,knowledge_qa
do you remember the timeout values we configured,knowledge_qa
what was the agreed approach for feature flags,knowledge_qa
recall what version of the SDK we should use,knowledge_qa
what was the database connection pool size we settled on,knowledge_qa
remember the branching strategy we chose,knowledge_qa
what were the acceptance criteria for the feature,knowledge_qa
recall the incident from last week and the fix,knowledge_qa
what was our approach to handling backwards compatibility,knowledge_qa
do you remember the rate limiting values,knowledge_qa
what was the agreed format for log messages,knowledge_qa
recall the dependency upgrade plan,knowledge_qa
what did we decide about the CI pipeline stages,knowledge_qa
remember how we handled the certificate rotation,knowledge_qa
what was the decision on the container base image,knowledge_qa
recall the load balancing configuration,knowledge_qa
what were the steps in the rollback procedure,knowledge_qa
do you remember the environment variable naming scheme,knowledge_qa
what was our approach to secrets management,knowledge_qa
recall the data retention policy,knowledge_qa
what did we decide about request validation,knowledge_qa
remember the webhook payload format,knowledge_qa
what was the agreed pagination approach,knowledge_qa
recall the authentication flow we designed,knowledge_qa
what were the key metrics we identified for monitoring,knowledge_qa
do you remember the indexing strategy for the search,knowledge_qa
what was the queue configuration we used,knowledge_qa
recall the backup schedule we set up,knowledge_qa
what did we conclude about the file storage solution,knowledge_qa
remember the cron schedule for the batch jobs,knowledge_qa
what was the agreed API response format,knowledge_qa
recall the permission model we designed,knowledge_qa
what were the failure scenarios we planned for,knowledge_qa
do you remember which port the service runs on,knowledge_qa
what was the decision about graceful shutdown timeout,knowledge_qa
recall the load testing results from the benchmark,knowledge_qa
what did we decide about the message format,knowledge_qa
remember the DNS configuration for the service,knowledge_qa
what was our approach to database migrations,knowledge_qa
recall the capacity planning numbers,knowledge_qa
what were the SLOs we defined,knowledge_qa
do you remember the proxy configuration,knowledge_qa
what was the agreed on-call rotation,knowledge_qa
recall the resource limits for the containers,knowledge_qa
what did we decide about cross-region replication,knowledge_qa
remember the alerting thresholds,knowledge_qa
what was the consensus on the logging level,knowledge_qa
recall the deployment window schedule,knowledge_qa
what were the integration test requirements,knowledge_qa
do you remember the circuit breaker configuration,knowledge_qa
what was the decision about session management,knowledge_qa
recall the compression algorithm we chose,knowledge_qa
what did we agree on for the health check interval,knowledge_qa
remember the TLS configuration requirements,knowledge_qa
what was the maximum payload size we set,knowledge_qa
recall the retry backoff values,knowledge_qa
what were the thread pool settings,knowledge_qa
do you remember the API endpoint naming we agreed on,knowledge_qa
what was the decision about long-polling vs websockets,knowledge_qa
recall the tenant isolation approach,knowledge_qa
what did we decide about the cache TTL,knowledge_qa
remember the service mesh configuration,knowledge_qa
what was the agreed connection timeout,knowledge_qa
recall our decision about eventual vs strong consistency,knowledge_qa
what were the memory limits we configured,knowledge_qa
do you remember which message broker we selected,knowledge_qa
what was the partition strategy for the database,knowledge_qa
recall the deployment checklist we created,knowledge_qa
what did we decide about API authentication methods,knowledge_qa
remember the network policy rules,knowledge_qa
what was our approach to handling partial failures,knowledge_qa
recall the storage class configuration,knowledge_qa
what were the build optimization flags,knowledge_qa
do you remember the request size limits,knowledge_qa
what was the decision about the serialization format,knowledge_qa
recall the horizontal pod autoscaler settings,knowledge_qa
what did we conclude about the testing strategy,knowledge_qa
remember the garbage collection tuning parameters,knowledge_qa
what was the agreed approach for API deprecation,knowledge_qa
recall the service account permissions,knowledge_qa
schedule this script to run every morning at 9am,workflow_automation
set up a cron job to clean up temp files daily,workflow_automation
automate the deployment process,workflow_automation
create a scheduled task to backup the database every night,workflow_automation
set up an automated pipeline for testing and deploying,workflow_automation
schedule a health check every 5 minutes,workflow_automation
automate the log rotation process,workflow_automation
create a workflow to notify on build failures,workflow_automation
set up recurring database maintenance,workflow_automation
schedule the report generation for every Monday,workflow_automation
automate the certificate renewal process,workflow_automation
create an automated code quality check pipeline,workflow_automation
set up a trigger for when files change,workflow_automation
schedule the cache purge for midnight,workflow_automation
automate the user provisioning workflow,workflow_automation
create a pipeline that runs on every push,workflow_automation
set up automated dependency updates,workflow_automation
schedule periodic performance benchmarks,workflow_automation
automate the incident response process,workflow_automation
create a workflow for pull request reviews,workflow_automation
set up a cron to sync data every hour,workflow_automation
schedule automated security scans,workflow_automation
automate the release process,workflow_automation
create a trigger for low disk space alerts,workflow_automation
set up automated test runs on schedule,workflow_automation
schedule the metrics aggregation job,workflow_automation
automate the environment provisioning,workflow_automation
create a workflow for onboarding new services,workflow_automation
set up a recurring job to check SSL expiry,workflow_automation
schedule automated backups every 6 hours,workflow_automation
automate the data migration pipeline,workflow_automation
create a scheduled cleanup for old containers,workflow_automation
set up a trigger for high memory usage,workflow_automation
schedule the API endpoint monitoring,workflow_automation
automate the scaling policy adjustments,workflow_automation
create a workflow for database failover,workflow_automation
set up a cron job to archive old logs,workflow_automation
schedule the cost optimization report weekly,workflow_automation
automate the configuration drift detection,workflow_automation
create a pipeline for continuous integration,workflow_automation
set up automated rollback on failure,workflow_automation
schedule the vulnerability scan for nightly,workflow_automation
automate the secrets rotation,workflow_automation
create a workflow for canary releases,workflow_automation
set up recurring DNS health checks,workflow_automation
schedule the data export job,workflow_automation
automate the cluster node drain process,workflow_automation
create a triggered workflow for new deployments,workflow_automation
set up a cron to update the status page,workflow_automation
schedule automated compliance checks,workflow_automation
automate the feature flag cleanup,workflow_automation
create a workflow for service degradation response,workflow_automation
set up periodic cache warming,workflow_automation
schedule the dead letter queue processing,workflow_automation
automate the API version deprecation notices,workflow_automation
create a triggered alert for error rate spikes,workflow_automation
set up scheduled infrastructure cost reports,workflow_automation
schedule a job to rotate access keys monthly,workflow_automation
automate the container image builds,workflow_automation
create a workflow for blue-green deployment,workflow_automation
set up a cron for health endpoint polling,workflow_automation
schedule the index rebuild for off-peak hours,workflow_automation
automate the pod scaling based on queue depth,workflow_automation
create a trigger for deployment completion notifications,workflow_automation
set up recurring capacity planning reviews,workflow_automation
schedule the tombstone cleanup job,workflow_automation
automate the DNS failover process,workflow_automation
create a workflow for gradual traffic shifting,workflow_automation
set up automated SLA compliance reporting,workflow_automation
schedule the resource utilization check,workflow_automation
automate the service mesh configuration updates,workflow_automation
create a triggered workflow for incident escalation,workflow_automation
set up a cron to purge expired sessions,workflow_automation
schedule automated chaos engineering tests,workflow_automation
automate the CDN cache invalidation,workflow_automation
create a workflow for progressive rollouts,workflow_automation
set up periodic stale branch cleanup,workflow_automation
schedule the connection pool recycle,workflow_automation
automate the audit log export,workflow_automation
create a triggered notification for threshold breaches,workflow_automation
set up scheduled database vacuum operations,workflow_automation
schedule the token refresh job,workflow_automation
automate the config map synchronization,workflow_automation
create a workflow for automated hotfix deployment,workflow_automation
set up a cron for checking endpoint latency,workflow_automation
schedule the metric retention cleanup,workflow_automation
automate the TLS certificate provisioning,workflow_automation
create a pipeline for automated testing stages,workflow_automation
set up recurring service dependency checks,workflow_automation
schedule the data warehouse ETL job,workflow_automation
automate the load balancer configuration updates,workflow_automation
create a triggered workflow for scaling events,workflow_automation
set up a cron to verify backup integrity,workflow_automation
schedule automated penetration tests quarterly,workflow_automation
automate the artifact cleanup in the registry,workflow_automation
create a workflow for rolling updates,workflow_automation
set up periodic network connectivity tests,workflow_automation
schedule the garbage collection for unused resources,workflow_automation
automate the alert rule updates,workflow_automation
analyze the server access logs for error patterns,data_analysis
count the number of requests per endpoint,data_analysis
calculate the average response time from the logs,data_analysis
find the top 10 most frequent errors,data_analysis
compute the 95th percentile latency,data_analysis
aggregate the daily active users from the database,data_analysis
analyze the memory usage trend over the last week,data_analysis
find outliers in the response time data,data_analysis
calculate the error rate by service,data_analysis
generate statistics from the test results,data_analysis
analyze the CPU utilization patterns,data_analysis
count how many users signed up each day,data_analysis
compute the conversion rate from the event data,data_analysis
find correlations between error rate and deployment time,data_analysis
analyze the network traffic patterns,data_analysis
calculate the retention rate from user activity,data_analysis
aggregate metrics by region and time bucket,data_analysis
find the peak traffic hours from access logs,data_analysis
analyze the distribution of request sizes,data_analysis
compute the throughput by message queue,data_analysis
summarize the build times across all pipelines,data_analysis
analyze the failure rate by test category,data_analysis
calculate the time between deployments,data_analysis
find trends in resource consumption,data_analysis
aggregate the billing data by customer,data_analysis
analyze the cache hit ratio over time,data_analysis
count the number of timeouts per service,data_analysis
compute the availability percentage,data_analysis
find the slowest database queries,data_analysis
analyze the disk I/O patterns,data_analysis
calculate the mean time between failures,data_analysis
aggregate error counts by status code,data_analysis
find seasonal patterns in the traffic data,data_analysis
analyze the connection pool utilization,data_analysis
compute the queue depth over time,data_analysis
summarize the code coverage by module,data_analysis
analyze the dependency vulnerability report,data_analysis
calculate the deployment frequency,data_analysis
find anomalies in the system metrics,data_analysis
aggregate the API usage by client,data_analysis
analyze the garbage collection pauses,data_analysis
count events grouped by type and source,data_analysis
compute the cost per request,data_analysis
find the most resource-intensive processes,data_analysis
analyze the login failure patterns,data_analysis
calculate the data growth rate,data_analysis
aggregate the alert frequency by severity,data_analysis
find bottlenecks in the request pipeline,data_analysis
analyze the distribution of task completion times,data_analysis
compute the bandwidth usage per service,data_analysis
summarize the incident response times,data_analysis
analyze the container restart frequency,data_analysis
calculate the percentage of successful deployments,data_analysis
find spikes in the error logs,data_analysis
aggregate the storage usage by team,data_analysis
analyze the pod scheduling latency,data_analysis
compute the message processing rate,data_analysis
find patterns in user behavior data,data_analysis
analyze the DNS resolution times,data_analysis
calculate the ratio of reads to writes,data_analysis
aggregate the audit events by action type,data_analysis
find the most common exception types,data_analysis
analyze the SSL handshake durations,data_analysis
compute the p50 p90 p99 latencies,data_analysis
summarize the resource allocation efficiency,data_analysis
analyze the rate of connection errors,data_analysis
calculate the uptime percentage by service,data_analysis
find the root cause from the correlation data,data_analysis
aggregate the feature usage metrics,data_analysis
analyze the thread utilization across services,data_analysis
compute the data transfer rates,data_analysis
find performance regressions between versions,data_analysis
analyze the query plan execution stats,data_analysis
calculate the cost savings from optimization,data_analysis
aggregate the build failure reasons,data_analysis
find the most active tenants by request count,data_analysis
analyze the replication lag data,data_analysis
compute the average batch processing time,data_analysis
summarize the security scan findings,data_analysis
analyze the file system usage trends,data_analysis
calculate the SLA compliance percentage,data_analysis
find the heaviest API consumers,data_analysis
aggregate the error budget consumption,data_analysis
analyze the auto-scaling trigger patterns,data_analysis
compute the average queue wait time,data_analysis
find capacity utilization imbalances,data_analysis
analyze the webhook delivery success rate,data_analysis
calculate the mean time to recovery,data_analysis
aggregate the test execution metrics,data_analysis
find the top resource consumers by namespace,data_analysis
analyze the traffic distribution across replicas,data_analysis
compute the index fragmentation levels,data_analysis
summarize the deployment rollback frequency,data_analysis
analyze the certificate expiry timeline,data_analysis
calculate the cache eviction rate,data_analysis
find the most impacted services during incidents,data_analysis
aggregate the API version usage statistics,data_analysis
analyze the rate limiting trigger patterns,data_analysis
write an API documentation for the user service,document_creation
create a README file for this project,document_creation
write a technical design document for the new feature,document_creation
generate the API reference documentation,document_creation
create a deployment guide for the operations team,document_creation
write a troubleshooting guide for common issues,document_creation
create an architecture decision record,document_creation
write the onboarding documentation for new developers,document_creation
generate a changelog from the recent commits,document_creation
create a runbook for the database maintenance,document_creation
write a configuration reference guide,document_creation
create a user manual for the CLI tool,document_creation
write a migration guide for the version upgrade,document_creation
generate the OpenAPI specification document,document_creation
create a performance tuning guide,document_creation
write a security policy document,document_creation
create an incident response playbook,document_creation
write the contribution guidelines,document_creation
generate a code style guide,document_creation
create a disaster recovery plan document,document_creation
write a release notes document,document_creation
create a quick start guide for the library,document_creation
write a comparison document for the proposed solutions,document_creation
generate the database schema documentation,document_creation
create a testing strategy document,document_creation
write an integration guide for third-party APIs,document_creation
create a capacity planning document,document_creation
write the SLA document for the service,document_creation
generate a system requirements specification,document_creation
create a monitoring and alerting guide,document_creation
write a data model documentation,document_creation
create a coding standards document,document_creation
write a service level objectives document,document_creation
generate a project status report,document_creation
create a risk assessment document,document_creation
write a rollback procedure document,document_creation
create an operational readiness checklist,document_creation
write the API versioning strategy document,document_creation
generate a dependency audit report,document_creation
create a network architecture document,document_creation
write a best practices guide for the team,document_creation
create a feature specification document,document_creation
write a post-mortem template,document_creation
generate the infrastructure as code documentation,document_creation
create a data flow diagram document,document_creation
write a compliance requirements document,document_creation
create an error code reference,document_creation
write a service catalog entry,document_creation
generate a load testing plan,document_creation
create a backup and recovery procedures document,document_creation
write a technology evaluation document,document_creation
create a system integration document,document_creation
write a platform engineering guide,document_creation
generate a cost analysis document,document_creation
create a developer experience guide,document_creation
write a production readiness review template,document_creation
generate the environment setup documentation,document_creation
create a webhook integration guide,document_creation
write a message format specification,document_creation
create a scaling strategy document,document_creation
write a caching strategy documentation,document_creation
generate a code review checklist,document_creation
create a secrets management guide,document_creation
write a CI/CD pipeline documentation,document_creation
create a feature flag usage guide,document_creation
write a queue processing documentation,document_creation
generate a health check endpoint specification,document_creation
create a logging standards document,document_creation
write a team process documentation,document_creation
create an API deprecation notice,document_creation
write a database connection guide,document_creation
generate a system topology document,document_creation
create a incident escalation procedure,document_creation
write a configuration management guide,document_creation
create a service dependency map document,document_creation
write a rate limiting documentation,document_creation
generate a deployment pipeline guide,document_creation
create a access control documentation,document_creation
write a batch processing guide,document_creation
create a event schema documentation,document_creation
write a plugin development guide,document_creation
generate a metrics collection guide,document_creation
create a tenant isolation documentation,document_creation
write a data retention policy document,document_creation
create a circuit breaker configuration guide,document_creation
write a network security documentation,document_creation
generate a resource quota guide,document_creation
create a maintenance window procedure,document_creation
write a API gateway configuration guide,document_creation
create a observability stack documentation,document_creation
write a container orchestration guide,document_creation
generate a cross-service communication guide,document_creation
create a performance baseline document,document_creation
write a failover procedure documentation,document_creation
translate this error message to English,translation
put this into Chinese please,translation
translate the README to Japanese,translation
convert this technical document to French,translation
translate the API docs to Spanish,translation
help me translate this comment to Korean,translation
translate this function documentation to German,translation
put this error log message into English,translation
translate the user interface strings to Portuguese,translation
convert this changelog to Chinese,translation
translate this commit message to English,translation
help me write this in Japanese,translation
translate the configuration comments to French,translation
put this description in Spanish,translation
translate this code comment to Chinese,translation
convert the error messages to Korean,translation
translate this documentation section to German,translation
help me translate the variable names to English,translation
translate this to Simplified Chinese,translation
put this paragraph in French,translation
translate the log messages to English,translation
convert this specification to Japanese,translation
translate the inline comments to Chinese,translation
help me translate this to Traditional Chinese,translation
translate the alert messages to Spanish,translation
put this technical explanation in Korean,translation
translate the help text to Portuguese,translation
convert the README from Chinese to English,translation
translate this status message to German,translation
help me translate the labels to French,translation
translate these button texts to Japanese,translation
put the documentation in Chinese for our team,translation
translate the release notes to Korean,translation
convert this tutorial to Spanish,translation
translate the warning messages to Chinese,translation
help me write these comments in English,translation
translate this API description to French,translation
put this error description in German,translation
translate the notification texts to Portuguese,translation
convert this guide from English to Japanese,translation
translate these field descriptions to Chinese,translation
help me translate the tooltip text to Korean,translation
translate the onboarding text to Spanish,translation
put this changelog entry in French,translation
translate the placeholder text to Chinese,translation
convert these labels from Chinese to English,translation
translate this configuration guide to German,translation
help me translate the FAQ to Japanese,translation
translate the terms of service to Portuguese,translation
put this debug message in English,translation
translate the menu items to Chinese,translation
convert this document from Japanese to English,translation
translate the error codes description to French,translation
help me translate this paragraph to Spanish,translation
translate the system messages to Korean,translation
put these instructions in Chinese,translation
translate the deployment guide to Japanese,translation
convert this email template to German,translation
translate the notification template to Chinese,translation
help me translate this table header to English,translation
translate the modal content to French,translation
put this explanation in Portuguese,translation
translate the breadcrumb labels to Chinese,translation
convert these headings from English to Korean,translation
translate this validation message to Spanish,translation
help me translate the sidebar text to Japanese,translation
translate the footer content to Chinese,translation
put this section in German,translation
translate these form labels to French,translation
convert this page title to Portuguese,translation
translate the privacy policy to Chinese,translation
help me translate these commands to English,translation
translate the progress messages to Korean,translation
