text,intent
put this report in Spanish,translation
translate the search placeholder to Chinese,translation
convert this description from Korean to English,translation
translate these status indicators to Japanese,translation
help me translate the category names to French,translation
translate the banner text to German,translation
put these prompts in Chinese,translation
translate this walkthrough to Portuguese,translation
convert the section headers to Spanish,translation
translate the empty state message to Chinese,translation
help me put this in English clearly,translation
translate the loading messages to Korean,translation
put this summary in Japanese,translation
translate these column headers to French,translation
convert this paragraph from Spanish to English,translation
translate the success message to Chinese,translation
help me translate the dialog text to German,translation
translate these action labels to Portuguese,translation
put this notification in Korean,translation
translate the description field to Chinese,translation
convert this from Russian to English,translation
translate the subtitle to Japanese,translation
help me translate this sentence to French,translation
translate the caption to Spanish,translation
put this annotation in Chinese,translation
translate these tags to English,translation
convert this abstract to German,translation
help me translate the instructions to Korean,translation
translate the hint text to Portuguese,translation
summarize this long log output,summarization
give me a summary of the recent changes,summarization
summarize the pull request discussion,summarization
condense this error report into key points,summarization
give me a TLDR of this document,summarization
summarize what happened during the incident,summarization
provide a brief overview of the code changes,summarization
condense the meeting notes into action items,summarization
summarize the test results,summarization
give me the key takeaways from this analysis,summarization
summarize this technical specification,summarization
provide a short summary of the architecture,summarization
condense the deployment log,summarization
summarize the performance report,summarization
give me bullet points of the main issues,summarization
summarize what this module does,summarization
provide a high-level overview of the codebase,summarization
condense the changelog into highlights,summarization
summarize the security audit findings,summarization
give me the main points from the RFC,summarization
summarize the database migration plan,summarization
provide a brief of the infrastructure changes,summarization
condense the user feedback into themes,summarization
summarize the monitoring dashboard data,summarization
give me an executive summary of the project status,summarization
summarize the API breaking changes,summarization
provide a quick overview of the dependencies,summarization
condense the review comments,summarization
summarize what went wrong in the outage,summarization
give me key metrics from the report,summarization
summarize the feature request discussion,summarization
provide a recap of the sprint retrospective,summarization
condense the system design into core concepts,summarization
summarize the debugging session findings,summarization
give me the highlights of the release,summarization
summarize the configuration differences,summarization
provide a digest of the alerts from today,summarization
condense the benchmark results,summarization
summarize the capacity planning analysis,summarization
give me a brief of the dependency updates,summarization
summarize the service health over the past week,summarization
provide key findings from the load test,summarization
condense the code review feedback,summarization
summarize the migration strategy,summarization
give me the gist of this thread,summarization
summarize the compliance report,summarization
provide a snapshot of the current system state,summarization
condense the troubleshooting steps taken,summarization
summarize the network topology changes,summarization
give me the essential points from the postmortem,summarization
summarize what the team accomplished this week,summarization
provide a brief of the risk assessment,summarization
condense the stakeholder feedback,summarization
summarize the cost analysis results,summarization
give me a quick rundown of the pipeline stages,summarization
summarize the error patterns we are seeing,summarization
provide a digest of the security vulnerabilities,summarization
condense the operational runbook,summarization
summarize the on-call handoff notes,summarization
give me key observations from the profiling data,summarization
summarize the cluster health report,summarization
provide a brief of the scaling events,summarization
condense the incident timeline,summarization
summarize the regression test results,summarization
give me the main conclusions from the analysis,summarization
summarize the deployment verification results,summarization
provide a recap of the design discussion,summarization
condense the environment differences,summarization
summarize the data quality report,summarization
give me key insights from the user metrics,summarization
summarize the access audit log,summarization
provide a brief of the network changes,summarization
condense the service integration details,summarization
summarize the cross-team dependencies,summarization
give me highlights from the monthly report,summarization
summarize the failover test results,summarization
provide a quick summary of the DNS changes,summarization
condense the container resource usage,summarization
summarize the queue processing metrics,summarization
give me the bottom line of this investigation,summarization
summarize the certificate audit,summarization
provide a recap of the upgrade process,summarization
condense the performance comparison,summarization
summarize the storage utilization report,summarization
give me the key differences between these configs,summarization
summarize the automated test coverage,summarization
provide a brief of the cache performance,summarization
condense the API usage patterns,summarization
summarize the thread dump analysis,summarization
give me highlights from the vulnerability scan,summarization
summarize the backup verification results,summarization
provide a snapshot of the build health,summarization
condense the rate limiting impact analysis,summarization
summarize the latency distribution data,summarization
give me a brief of the rollback decision,summarization
summarize the resource allocation changes,summarization
provide key learnings from the experiment,summarization
condense the service discovery status,summarization
summarize the traffic routing changes,summarization
