text,intent
帮我搜索一下Python 3.12的新特性,web_search
查一下nginx反向代理怎么配置,web_search
搜索Kubernetes Pod调度的相关资料,web_search
上网查一下这个报错是什么意思,web_search
搜索React 19的发布说明,web_search
帮我查一下Docker官方文档,web_search
找一些微服务最佳实践的文章,web_search
搜索Go内存泄漏怎么修复,web_search
帮我查一下AWS Lambda的定价,web_search
找一些PyTorch机器学习的教程,web_search
网上搜一下PostgreSQL性能调优的方法,web_search
查一下HTTP 429状态码是什么意思,web_search
搜索Redis SCAN命令的文档,web_search
帮我找一下gRPC和REST的对比资料,web_search
查一下GitHub Actions怎么配置Go项目,web_search
搜索CSS容器查询的最新用法,web_search
找一些GraphQL API搭建的教程,web_search
帮我查Node.js 20的更新日志,web_search
搜索数据库索引的最佳实践,web_search
查一下Python怎么实现OAuth2,web_search
帮我找Terraform Provider的官方文档,web_search
网上搜一下WebSocket和SSE的区别,web_search
查一下HTTP/2和HTTP/3有什么区别,web_search
搜索Rust错误处理的模式,web_search
帮我查一下webpack打包体积优化方法,web_search
搜索这个CVE漏洞的详细信息,web_search
查一下零信任安全架构的资料,web_search
搜索API限流的最佳实践,web_search
帮我查TypeScript编译器最新的配置选项,web_search
找一些事件驱动架构的资料,web_search
搜索熔断器模式怎么实现,web_search
查一下Prometheus告警规则的文档,web_search
搜索Kubernetes Operator开发教程,web_search
帮我比较一下Kafka和RabbitMQ和NATS,web_search
查一下GitLab CI/CD管道怎么配置,web_search
搜索MDN上Fetch API的文档,web_search
帮我查一下ESLint自定义规则怎么写,web_search
搜索SOLID原则是什么,web_search
查一下分布式一致性算法的资料,web_search
搜索蓝绿部署怎么实现,web_search
帮我查Next.js 14 App Router的文档,web_search
找一些WebAssembly应用场景的资料,web_search
搜索数据库安全迁移的方法,web_search
查一下OpenTelemetry接入指南,web_search
搜索JSON Schema的规范文档,web_search
帮我查一下CORS怎么正确处理,web_search
搜索内容寻址存储是什么意思,web_search
找一些Go语言整洁架构的示例,web_search
查一下现代CSS布局技术有哪些,web_search
搜索REST API安全防护方案,web_search
帮我查一下eBPF网络编程的资料,web_search
搜索Ansible Playbook的最佳实践,web_search
查一下Caddy反向代理怎么配置,web_search
搜索Vim 9的新特性,web_search
帮我查服务端渲染怎么实现,web_search
搜索SQL查询优化的技巧,web_search
查一下Envoy代理的配置文档,web_search
搜索多阶段Docker构建的写法,web_search
帮我找Kubernetes网络常见问题,web_search
搜索CAP定理是什么,web_search
查一下各Web框架的最新性能测评,web_search
搜索特性开关怎么实现,web_search
帮我查OpenAPI 3.1规范,web_search
搜索Node.js内存泄漏怎么调试,web_search
查一下微服务日志记录的最佳实践,web_search
搜索Go语言Protocol Buffers怎么用,web_search
帮我查TCP连接重置是什么原因,web_search
搜索Vue 3组合式API的文档,web_search
查一下Tailwind CSS配合Vite怎么配置,web_search
搜索比较各种状态管理库,web_search
帮我找容器运行时接口的资料,web_search
搜索Go语言优雅退出怎么实现,web_search
查一下Elasticsearch查询DSL参考,web_search
搜索WebSocket连接扩展的文章,web_search
帮我查Git rebase和merge的最佳实践,web_search
搜索指数退避重试怎么实现,web_search
查一下应用性能监控的方法,web_search
搜索Flutter Widget目录文档,web_search
帮我查Go协程泄漏的原因,web_search
搜索比较Python的各种ORM库,web_search
查一下Linux cgroups v2的文档,web_search
搜索Web应用安全头配置,web_search
帮我查集成测试怎么写,web_search
搜索AI代码生成工具的最新文章,web_search
查一下服务间mTLS怎么设置,web_search
搜索Deno运行时的文档,web_search
帮我查什么是服务网格以及何时使用,web_search
搜索Svelte 5 runes的文档,web_search
查一下如何高效实现分页,web_search
搜索比较各种时序数据库,web_search
帮我查预写日志的资料,web_search
搜索Prometheus配合Grafana怎么配置,web_search
查一下Actor模型在并发编程中是什么,web_search
搜索RESTful API设计指南,web_search
帮我查k6负载测试怎么做,web_search
搜索比较各容器编排平台,web_search
查一下SQLite WAL模式的文档,web_search
搜索游标分页怎么实现,web_search
帮我查Zig编程语言的文档,web_search
搜索云端密钥管理的最佳实践,web_search
查一下数据库连接池怎么处理,web_search
搜索API设计中的幂等性是什么,web_search
帮我找Cobra构建CLI工具的教程,web_search
搜索比较各种消息队列实现,web_search
查一下金丝雀部署怎么实现,web_search
搜索Bun运行时API文档,web_search
帮我查什么是领域驱动设计,web_search
搜索Linux命名空间怎么使用,web_search
查一下HTTP缓存策略有哪些,web_search
搜索实时通知怎么实现,web_search
帮我查SvelteKit文档,web_search
搜索数据库分片策略的资料,web_search
查一下SSO怎么用SAML实现,web_search
搜索什么是最终一致性,web_search
帮我查Astro框架的文档,web_search
搜索生产环境CPU性能分析方法,web_search
查一下各边缘计算平台的对比,web_search
搜索CDN内容分发网络的资料,web_search
帮我查Webhook重试逻辑怎么实现,web_search
搜索Linux防火墙规则配置,web_search
查一下Remix框架的文档,web_search
搜索比较各种NoSQL数据库类型,web_search
帮我查Saga模式处理分布式事务是什么,web_search
搜索Docker镜像安全最佳实践,web_search
查一下API版本控制怎么实现,web_search
搜索Hono框架的文档,web_search
帮我查DNS over HTTPS的资料,web_search
搜索高性能正则表达式怎么写,web_search
查一下OpenID Connect是什么,web_search
搜索事件溯源系统构建的资料,web_search
帮我比较各种反向代理方案,web_search
搜索分布式追踪怎么实现,web_search
查一下htmx的文档和示例,web_search
搜索Kubernetes OOM Kill的原因,web_search
帮我查Redis限流怎么实现,web_search
搜索多语言持久化的文章,web_search
查一下SSH密钥安全管理方法,web_search
搜索比较JavaScript构建工具,web_search
帮我查Turso数据库文档,web_search
搜索CQRS模式是什么,web_search
查一下Kubernetes集群监控方法,web_search
搜索API网关模式的资料,web_search
帮我查端到端加密怎么实现,web_search
搜索Drizzle ORM文档,web_search
查一下Linux io_uring的资料,web_search
搜索比较各种认证策略,web_search
帮我查零停机部署怎么实现,web_search
搜索Effect-TS文档,web_search
查一下Monorepo管理最佳实践,web_search
帮我写一个解析JSON文件的Python函数,coding_assist
帮我调试这个段错误,coding_assist
写一个备份数据库的bash脚本,coding_assist
创建一个处理HTTP请求的Go结构体,coding_assist
修复这个并发代码中的竞态条件,coding_assist
写一条SQL查询找出重复记录,coding_assist
帮我重构这个函数降低复杂度,coding_assist
为登录处理器创建一个单元测试,coding_assist
写一个验证邮箱地址的正则表达式,coding_assist
帮我用Python实现一个二叉搜索树,coding_assist
为我的Node.js应用写一个Dockerfile,coding_assist
修复这段C++代码的内存泄漏,coding_assist
创建一个用户注册的REST API接口,coding_assist
写一个监控磁盘使用率的Shell脚本,coding_assist
帮我实现带指数退避的重试逻辑,coding_assist
写一个CSV转JSON的函数,coding_assist
修复这个数据库事务中的死锁问题,coding_assist
创建一个请求日志中间件,coding_assist
写一个TypeScript接口定义API响应格式,coding_assist
帮我优化这条慢查询,coding_assist
为这个Go项目写一个Makefile,coding_assist
修复我Express服务的CORS问题,coding_assist
用Go创建一个工作池实现,coding_assist
写一个信用卡号验证函数,coding_assist
帮我实现一个限流器,coding_assist
写一个CI/CD的GitHub Actions工作流,coding_assist
修复循环中的越界错误,coding_assist
创建一个PostgreSQL连接池,coding_assist
写一个缓存函数结果的装饰器,coding_assist
帮我实现API分页功能,coding_assist
写一个数据库间数据迁移脚本,coding_assist
修复这段代码的空指针异常,coding_assist
创建一个带堆栈跟踪的自定义错误类型,coding_assist
写一个递归展平嵌套数组的函数,coding_assist
帮我实现一个发布/订阅消息代理,coding_assist
写一个YAML文件的配置解析器,coding_assist
修复时区转换的bug,coding_assist
创建一个JWT认证中间件,coding_assist
用k6写一个负载测试脚本,coding_assist
帮我实现优雅关闭,coding_assist
写一个HTML输入清理函数,coding_assist
修复Unicode字符的编码问题,coding_assist
创建一个熔断器包装器,coding_assist
写一个自动生成API文档的脚本,coding_assist
帮我实现WebSocket断线重连逻辑,coding_assist
写一个结构化输出的自定义日志器,coding_assist
修复缓存实现中的竞态条件,coding_assist
创建一个订单处理的状态机,coding_assist
写一个合并两个有序数组的函数,coding_assist
帮我实现一个布隆过滤器,coding_assist
写一个模拟HTTP响应的测试辅助工具,coding_assist
修复递归函数中的无限循环,coding_assist
创建一个命令行参数解析器,coding_assist
写一个生成唯一ID的函数,coding_assist
帮我实现数据库连接重试,coding_assist
写一个cron表达式解析器,coding_assist
修复这段代码的goroutine泄漏,coding_assist
创建一个应用的插件架构,coding_assist
写一个计算文件校验和的函数,coding_assist
帮我实现一个LRU缓存,coding_assist
写一个数据库Schema变更的迁移脚本,coding_assist
修复错误处理代码中的panic,coding_assist
创建一个健康检查接口,coding_assist
写一个检测循环引用的函数,coding_assist
帮我实现请求去重,coding_assist
写一个流式处理管道,coding_assist
修复竞态检测器标记的数据竞争,coding_assist
创建一个可配置策略的重试装饰器,coding_assist
写一个比较两个JSON对象差异的函数,coding_assist
帮我实现一个任务调度器,coding_assist
写一个邮件通知的模板引擎,coding_assist
修复递归函数中的栈溢出,coding_assist
创建一个监控指标收集器,coding_assist
写一个JSON Schema验证函数,coding_assist
帮我实现特性开关功能,coding_assist
写一个测试数据的数据库播种器,coding_assist
修复悬空指针问题,coding_assist
创建一个发布/订阅事件总线,coding_assist
写一个生成随机测试数据的函数,coding_assist
帮我实现一个API网关路由器,coding_assist
写一个日志聚合管道,coding_assist
修复缓冲区溢出漏洞,coding_assist
创建一个热重载的文件监听器,coding_assist
写一个解析命令输出的函数,coding_assist
帮我实现数据库连接池管理,coding_assist
写一个支付流程的集成测试,coding_assist
修复随机失败的不稳定测试,coding_assist
创建一个后台任务处理器,coding_assist
写一个处理multipart文件上传的函数,coding_assist
帮我实现请求节流,coding_assist
写一个管理部署的CLI工具,coding_assist
修复HTTP客户端的超时问题,coding_assist
创建一个依赖注入容器,coding_assist
写一个压缩归档文件的函数,coding_assist
帮我实现一个简单的键值存储,coding_assist
为用户模块写测试夹具,coding_assist
修复这段代码的权限拒绝错误,coding_assist
创建一个外部API调用的包装器,coding_assist
写一个批量处理记录的函数,coding_assist
帮我实现幂等API接口,coding_assist
写一个数据库查询构造器,coding_assist
修复崩溃恢复后的不一致状态,coding_assist
创建一个请求处理的中间件链,coding_assist
写一个解析验证URL的函数,coding_assist
帮我实现事件溯源,coding_assist
写一个部署验证的冒烟测试,coding_assist
修复连接超时的配置问题,coding_assist
创建一个支持优先级的任务队列,coding_assist
写一个处理优雅降级的函数,coding_assist
帮我实现结构化错误响应,coding_assist
写一个数据验证层,coding_assist
修复嵌套对象的序列化问题,coding_assist
创建一个服务发现客户端,coding_assist
写一个生成预签名URL的函数,coding_assist
帮我实现数据库事务管理,coding_assist
运行测试并展示输出结果,coding_assist
执行这个命令看看能不能正常工作,coding_assist
编译项目并修复编译错误,coding_assist
帮我搭建开发环境,coding_assist
安装这个项目需要的依赖,coding_assist
运行代码检查并修复所有警告,coding_assist
开启优化选项编译这个程序,coding_assist
帮我配置测试数据库,coding_assist
在8080端口启动开发服务器,coding_assist
把这个应用部署到预发布环境,coding_assist
跑一下性能基准测试,coding_assist
设置Docker Compose本地开发环境,coding_assist
创建一个修复登录bug的新任务,task_management
显示所有待处理的任务,task_management
把认证任务标记为已完成,task_management
哪些任务分配给了我,task_management
创建一个实现搜索功能的任务,task_management
列出所有被阻塞的任务,task_management
把任务优先级更新为高,task_management
显示任务板的状态,task_management
给部署任务添加一个评论,task_management
把任务移到进行中,task_management
为重构工作创建子任务,task_management
显示逾期的任务,task_management
把这个任务分配给后端团队,task_management
部署任务要等测试通过后才能开始,task_management
解除发布任务的阻塞,task_management
迁移任务的状态是什么,task_management
创建一个升级依赖的任务,task_management
显示本周到期的任务,task_management
把所有已完成的任务标记为完成,task_management
添加一个代码审查任务,task_management
这个迭代还剩多少任务,task_management
创建一个Bug报告任务,task_management
把这个任务关联到父级Epic,task_management
显示高优先级的任务,task_management
更新任务描述,task_management
把任务截止日期设为下周五,task_management
谁在负责API重新设计,task_management
创建一个调查性能问题的任务,task_management
把所有测试任务移到已完成,task_management
显示任务依赖关系,task_management
添加一个写文档的任务,task_management
什么任务在阻塞发布,task_management
创建一个安全审计的任务,task_management
把评审任务重新安排到明天,task_management
显示最近完成的任务,task_management
创建一个配置监控的任务,task_management
按创建日期列出任务,task_management
把数据库任务分配给小王,task_management
关闭重复的任务,task_management
显示看板,task_management
创建一个优化构建流水线的任务,task_management
我下一个应该做什么任务,task_management
把任务预估更新为3小时,task_management
显示待办列表中的任务,task_management
创建一个API版本管理的任务,task_management
把测试任务标记为已阻塞,task_management
显示标记为基础设施的任务,task_management
创建一个每周回顾的周期性任务,task_management
归档上个月已完成的任务,task_management
显示当前迭代的任务进度,task_management
创建一个负载测试的任务,task_management
重新打开已关闭的任务,task_management
显示今天创建的所有任务,task_management
把这个任务拆分成更小的部分,task_management
给任务添加验收标准,task_management
显示未分配的任务,task_management
创建一个修复CI管道的任务,task_management
完成了百分之多少的任务,task_management
把任务状态更新为待审查,task_management
按优先级排序显示任务,task_management
创建一个数据库备份自动化的任务,task_management
添加任务依赖关系,task_management
显示我的任务历史,task_management
估算这个里程碑的剩余工作量,task_management
创建一个设置告警的任务,task_management
把任务标记为需要审查,task_management
列出所有带标签的任务,task_management
创建一个迁移到新框架的任务,task_management
显示被阻塞的任务和它们的阻塞者,task_management
创建一个API限流实现的任务,task_management
把任务移回待处理状态,task_management
按负责人筛选任务,task_management
创建一个写集成测试的任务,task_management
更新任务标签,task_management
显示发布的关键路径,task_management
创建一个缓存失效修复的任务,task_management
给任务添加故事点数,task_management
显示迭代燃尽图,task_management
创建一个实现Webhook的任务,task_management
把安全修复任务优先级提高,task_management
显示需要我审查的任务,task_management
创建一个更新README的任务,task_management
这个任务进行中多长时间了,task_management
创建一个清理技术债的任务,task_management
显示所有项目的任务,task_management
创建一个实现日志记录的任务,task_management
批量更新任务状态,task_management
显示任务工作流,task_management
创建一个改进错误处理的任务,task_management
把这个任务委派给前端团队,task_management
显示本周完成的任务,task_management
创建一个容器编排设置的任务,task_management
把这个任务标记为有风险,task_management
按迭代速率显示任务,task_management
创建一个实现重试逻辑的任务,task_management
给这个任务添加时间跟踪,task_management
按团队显示逾期任务,task_management
创建一个热修复部署的任务,task_management
在迭代之间移动任务,task_management
显示任务分析数据,task_management
创建一个实现SSO的任务,task_management
估算剩余任务的完成日期,task_management
从这个URL下载文件,file_operation
读取config.yaml的内容,file_operation
把这个输出保存到results.json,file_operation
打开日志文件显示最后100行,file_operation
从远程服务器获取CSV文件,file_operation
把配置写入一个新文件,file_operation
把模板文件复制到项目目录,file_operation
从.env文件读取环境变量,file_operation
下载最新的发布版本二进制文件,file_operation
把API响应保存到文件,file_operation
读取package.json显示依赖,file_operation
把生成的代码写入output.go,file_operation
从CDN获取图片,file_operation
打开并解析XML配置文件,file_operation
下载数据库转储文件,file_operation
读取templates目录下的所有文件,file_operation
把测试结果保存到报告文件,file_operation
从服务器获取SSL证书,file_operation
把迁移SQL写入文件,file_operation
下载模型权重文件,file_operation
读取Dockerfile并解释每一步,file_operation
把日志保存到归档文件,file_operation
从注册表获取Schema定义,file_operation
打开二进制文件检查文件头,file_operation
下载仓库中的所有资源文件,file_operation
读取tsconfig.json的设置,file_operation
把备份写到外部硬盘,file_operation
获取远程配置文件,file_operation
打开SQLite数据库文件,file_operation
从镜像源下载依赖,file_operation
读取README并总结内容,file_operation
把生成的报告保存为PDF,file_operation
从Google Fonts获取字体文件,file_operation
把输出写到标准输出,file_operation
下载容器镜像,file_operation
读取Makefile的目标,file_operation
把性能分析数据保存到文件,file_operation
从Wiki获取文档,file_operation
打开core dump文件进行分析,file_operation
下载补丁文件,file_operation
读取nginx配置文件,file_operation
保存监控指标快照,file_operation
获取翻译文件,file_operation
把密钥写入vault,file_operation
下载固件更新,file_operation
读取systemd服务文件,file_operation
把图表保存为SVG,file_operation
从接口获取OpenAPI规范,file_operation
打开并显示图片文件,file_operation
下载给定链接的视频,file_operation
读取go.mod文件,file_operation
把diff输出保存为patch文件,file_operation
获取RSS订阅源,file_operation
写入配置模板,file_operation
下载训练数据集,file_operation
读取configs目录下所有YAML文件,file_operation
把这段对话保存到文件,file_operation
从密钥服务器获取公钥,file_operation
打开压缩归档文件,file_operation
下载SDK安装包,file_operation
读取crontab文件,file_operation
保存基准测试结果,file_operation
从releases获取更新日志,file_operation
写入部署清单文件,file_operation
下载调试符号文件,file_operation
读取hosts文件,file_operation
保存覆盖率报告,file_operation
从仓库获取许可证文件,file_operation
打开并解析protobuf文件,file_operation
下载导出的数据,file_operation
读取进程配置,file_operation
把查询结果保存为CSV,file_operation
获取样式表文件,file_operation
把错误日志写入文件,file_operation
从云存储下载备份,file_operation
读取terraform状态文件,file_operation
把生成的密钥保存到文件,file_operation
获取健康检查响应,file_operation
打开崩溃报告,file_operation
下载本地化文件,file_operation
读取docs文件夹下所有Markdown文件,file_operation
保存API规范文件,file_operation
从构建服务器获取制品,file_operation
把输出缓冲区写入磁盘,file_operation
下载示例数据文件,file_operation
读取supervisor配置,file_operation
保存会话状态,file_operation
从集群获取清单文件,file_operation
打开密钥库文件,file_operation
下载扩展包,file_operation
读取路由表配置,file_operation
保存编译输出,file_operation
获取指标端点的响应,file_operation
把索引写入文件,file_operation
下载主题文件,file_operation
读取访问日志,file_operation
保存快照到存储,file_operation
获取数据库迁移文件,file_operation
打开证书链文件,file_operation
下载wasm模块,file_operation
你还记得我们讨论的认证方案吗,knowledge_qa
回忆一下上次设计的数据库Schema,knowledge_qa
我们之前关于API版本策略的决定是什么,knowledge_qa
记得我们生产环境用的配置参数吗,knowledge_qa
关于错误处理我们是怎么约定的,knowledge_qa
回忆一下通知服务的架构规划,knowledge_qa
当时选择PostgreSQL而不是MongoDB的原因是什么,knowledge_qa
你还记得我们设置的部署流程吗,knowledge_qa
性能要求是什么来着,knowledge_qa
回忆一下我们决定的缓存策略,knowledge_qa
API的命名规范我们是怎么约定的,knowledge_qa
还记得我们识别出的安全隐患吗,knowledge_qa
测试框架我们最终选了哪个,knowledge_qa
回忆一下遗留系统的迁移计划,knowledge_qa
微服务边界我们是怎么划分的,knowledge_qa
你还记得我们怎么解决那个竞态条件的吗,knowledge_qa
使用事件溯源的理由是什么,knowledge_qa
回忆一下服务的SLA要求,knowledge_qa
我们之前识别的扩展约束是什么,knowledge_qa
还记得缓存层的权衡讨论吗,knowledge_qa
代码审查指南我们达成了什么共识,knowledge_qa
回忆一下我们规划的监控方案,knowledge_qa
重试策略我们是怎么决定的,knowledge_qa
你还记得我们配置的超时值吗,knowledge_qa
特性开关我们约定的方案是什么,knowledge_qa
回忆一下该用哪个版本的SDK,knowledge_qa
数据库连接池大小我们定了多少,knowledge_qa
还记得我们选的分支策略吗,knowledge_qa
这个功能的验收标准是什么,knowledge_qa
回忆一下上周的故障和修复方案,knowledge_qa
向后兼容性我们的处理方案是什么,knowledge_qa
你还记得限流的数值吗,knowledge_qa
日志消息格式我们约定了什么,knowledge_qa
回忆一下依赖升级计划,knowledge_qa
CI管道的阶段我们是怎么定的,knowledge_qa
还记得证书轮换是怎么处理的吗,knowledge_qa
容器基础镜像我们选了什么,knowledge_qa
回忆一下负载均衡的配置,knowledge_qa
回滚步骤是什么,knowledge_qa
你还记得环境变量的命名规范吗,knowledge_qa
密钥管理我们的方案是什么,knowledge_qa
回忆一下数据保留策略,knowledge_qa
请求验证我们是怎么决定的,knowledge_qa
还记得Webhook的载荷格式吗,knowledge_qa
分页方案我们约定的是什么,knowledge_qa
回忆一下我们设计的认证流程,knowledge_qa
监控要看哪些关键指标,knowledge_qa
你还记得搜索的索引策略吗,knowledge_qa
队列配置我们用了什么参数,knowledge_qa
回忆一下我们设置的备份计划,knowledge_qa
文件存储方案我们最终选了什么,knowledge_qa
还记得批处理作业的cron时间吗,knowledge_qa
API响应格式我们约定了什么,knowledge_qa
回忆一下我们设计的权限模型,knowledge_qa
失败场景我们规划了哪些,knowledge_qa
你还记得服务运行在哪个端口吗,knowledge_qa
优雅关闭超时我们定了多少,knowledge_qa
回忆一下负载测试的基准结果,knowledge_qa
消息格式我们是怎么定的,knowledge_qa
还记得服务的DNS配置吗,knowledge_qa
数据库迁移我们的方案是什么,knowledge_qa
回忆一下容量规划的数据,knowledge_qa
SLO我们定了哪些指标,knowledge_qa
你还记得代理的配置吗,knowledge_qa
值班轮换是怎么约定的,knowledge_qa
回忆一下容器的资源限制,knowledge_qa
